{
  "sections": [
    {
      "pages": [
        0
      ],
      "pageAreas": [
        {
          "pageIdx": 0,
          "areas": [
            {
              "x": 346,
              "y": 304,
              "width": 1341,
              "height": 435
            }
          ]
        }
      ],
      "start": "00:13.5",
      "end": "00:27.0"
    },
    {
      "pages": [
        0
      ],
      "pageAreas": [
        {
          "pageIdx": 0,
          "areas": [
            {
              "x": 1687,
              "y": 399,
              "width": 182,
              "height": 344
            },
            {
              "x": 160,
              "y": 735,
              "width": 843,
              "height": 395
            }
          ]
        }
      ],
      "start": "00:27.0",
      "end": "00:37.0"
    },
    {
      "pages": [
        0
      ],
      "pageAreas": [
        {
          "pageIdx": 0,
          "areas": [
            {
              "x": 1003,
              "y": 731,
              "width": 850,
              "height": 427
            },
            {
              "x": 140,
              "y": 1151,
              "width": 847,
              "height": 415
            }
          ]
        }
      ],
      "start": "00:37.0",
      "end": "00:54.1"
    },
    {
      "pages": [
        0
      ],
      "pageAreas": [
        {
          "pageIdx": 0,
          "areas": [
            {
              "x": 987,
              "y": 1158,
              "width": 664,
              "height": 431
            }
          ]
        }
      ],
      "start": "00:54.1",
      "end": "01:03.1"
    },
    {
      "pages": [
        0
      ],
      "pageAreas": [
        {
          "pageIdx": 0,
          "areas": [
            {
              "x": 1664,
              "y": 1178,
              "width": 193,
              "height": 407
            },
            {
              "x": 144,
              "y": 1578,
              "width": 969,
              "height": 498
            }
          ]
        }
      ],
      "start": "01:03.1",
      "end": "01:09.3"
    },
    {
      "pages": [
        0
      ],
      "pageAreas": [
        {
          "pageIdx": 0,
          "areas": [
            {
              "x": 1113,
              "y": 1590,
              "width": 688,
              "height": 486
            }
          ]
        }
      ],
      "start": "01:09.3",
      "end": "01:15.4"
    },
    {
      "pages": [
        0
      ],
      "pageAreas": [
        {
          "pageIdx": 0,
          "areas": [
            {
              "x": 164,
              "y": 2002,
              "width": 1219,
              "height": 486
            }
          ]
        }
      ],
      "start": "01:15.4",
      "end": "01:25.0"
    },
    {
      "pages": [
        0,
        1
      ],
      "pageAreas": [
        {
          "pageIdx": 0,
          "areas": [
            {
              "x": 1394,
              "y": 2049,
              "width": 443,
              "height": 455
            }
          ]
        },
        {
          "pageIdx": 1,
          "areas": [
            {
              "x": 160,
              "y": 106,
              "width": 257,
              "height": 474
            }
          ]
        }
      ],
      "start": "01:25.0",
      "end": "01:28.5"
    },
    {
      "pages": [
        1
      ],
      "pageAreas": [
        {
          "pageIdx": 1,
          "areas": [
            {
              "x": 409,
              "y": 125,
              "width": 478,
              "height": 459
            }
          ]
        }
      ],
      "start": "01:28.5",
      "end": "01:31.2"
    },
    {
      "pages": [
        1
      ],
      "pageAreas": [
        {
          "pageIdx": 1,
          "areas": [
            {
              "x": 900,
              "y": 70,
              "width": 961,
              "height": 506
            },
            {
              "x": 152,
              "y": 545,
              "width": 621,
              "height": 490
            }
          ]
        }
      ],
      "start": "01:31.2",
      "end": "01:43.1"
    },
    {
      "pages": [
        1
      ],
      "pageAreas": [
        {
          "pageIdx": 1,
          "areas": [
            {
              "x": 753,
              "y": 592,
              "width": 692,
              "height": 423
            }
          ]
        }
      ],
      "start": "01:43.1",
      "end": "01:50.9"
    },
    {
      "pages": [
        1
      ],
      "pageAreas": [
        {
          "pageIdx": 1,
          "areas": [
            {
              "x": 1454,
              "y": 588,
              "width": 407,
              "height": 419
            },
            {
              "x": 152,
              "y": 1063,
              "width": 668,
              "height": 407
            }
          ]
        }
      ],
      "start": "01:50.9",
      "end": "02:02.7"
    },
    {
      "pages": [
        1
      ],
      "pageAreas": [
        {
          "pageIdx": 1,
          "areas": [
            {
              "x": 840,
              "y": 1036,
              "width": 1029,
              "height": 399
            },
            {
              "x": 120,
              "y": 1479,
              "width": 581,
              "height": 407
            }
          ]
        }
      ],
      "start": "02:02.7",
      "end": "02:16.0"
    },
    {
      "pages": [
        1
      ],
      "pageAreas": [
        {
          "pageIdx": 1,
          "areas": [
            {
              "x": 702,
              "y": 1495,
              "width": 1151,
              "height": 399
            }
          ]
        }
      ],
      "start": "02:16.0",
      "end": "02:26.8"
    },
    {
      "pages": [
        1
      ],
      "pageAreas": [
        {
          "pageIdx": 1,
          "areas": [
            {
              "x": 132,
              "y": 1891,
              "width": 1729,
              "height": 518
            }
          ]
        }
      ],
      "start": "02:26.8",
      "end": "02:50.7"
    }
  ],
  "videoUrl": "https://www.youtube.com/watch?v=MswHKA4dako",
  "version": 1,
  "pageUrls": [
    "https://images2.imgbox.com/65/70/GUHRgkv7_o.jpg?download=true",
    "https://images2.imgbox.com/b6/c7/QJCUivyK_o.jpg?download=true"
  ]
}