{
  "sections": [
    {
      "pages": [
        0
      ],
      "pageAreas": [
        {
          "pageIdx": 0,
          "areas": [
            {
              "x": 281,
              "y": 390,
              "width": 1312,
              "height": 439
            },
            {
              "x": 42,
              "y": 806,
              "width": 499,
              "height": 443
            }
          ]
        }
      ],
      "start": "02:21.5",
      "end": "02:37.5"
    },
    {
      "pages": [
        0
      ],
      "pageAreas": [
        {
          "pageIdx": 0,
          "areas": [
            {
              "x": 604,
              "y": 928,
              "width": 945,
              "height": 343
            },
            {
              "x": 52,
              "y": 1272,
              "width": 661,
              "height": 452
            }
          ]
        }
      ],
      "start": "02:37.5",
      "end": "02:53.7"
    },
    {
      "pages": [
        0
      ],
      "pageAreas": [
        {
          "pageIdx": 0,
          "areas": [
            {
              "x": 757,
              "y": 1292,
              "width": 753,
              "height": 386
            },
            {
              "x": 72,
              "y": 1765,
              "width": 360,
              "height": 370
            }
          ]
        }
      ],
      "start": "02:54.2",
      "end": "03:03.9"
    },
    {
      "pages": [
        0
      ],
      "pageAreas": [
        {
          "pageIdx": 0,
          "areas": [
            {
              "x": 449,
              "y": 1781,
              "width": 1018,
              "height": 400
            }
          ]
        }
      ],
      "start": "03:03.9",
      "end": "03:16.0"
    },
    {
      "pages": [
        1,
        0
      ],
      "pageAreas": [
        {
          "pageIdx": 1,
          "areas": [
            {
              "x": 142,
              "y": 171,
              "width": 575,
              "height": 393
            }
          ]
        },
        {
          "pageIdx": 0,
          "areas": [
            {
              "x": 1408,
              "y": 1765,
              "width": 138,
              "height": 317
            }
          ]
        }
      ],
      "start": "03:16.0",
      "end": "03:22.5"
    },
    {
      "pages": [
        1
      ],
      "pageAreas": [
        {
          "pageIdx": 1,
          "areas": [
            {
              "x": 710,
              "y": 155,
              "width": 856,
              "height": 439
            },
            {
              "x": 59,
              "y": 611,
              "width": 323,
              "height": 323
            }
          ]
        }
      ],
      "start": "03:22.5",
      "end": "03:32.5"
    },
    {
      "pages": [
        1
      ],
      "pageAreas": [
        {
          "pageIdx": 1,
          "areas": [
            {
              "x": 400,
              "y": 595,
              "width": 1143,
              "height": 347
            }
          ]
        }
      ],
      "start": "03:32.5",
      "end": "03:44.9"
    },
    {
      "pages": [
        1
      ],
      "pageAreas": [
        {
          "pageIdx": 1,
          "areas": [
            {
              "x": 95,
              "y": 988,
              "width": 1352,
              "height": 370
            }
          ]
        }
      ],
      "start": "03:44.9",
      "end": "03:55.2"
    },
    {
      "pages": [
        1
      ],
      "pageAreas": [
        {
          "pageIdx": 1,
          "areas": [
            {
              "x": 1441,
              "y": 1001,
              "width": 128,
              "height": 360
            },
            {
              "x": 92,
              "y": 1365,
              "width": 1497,
              "height": 396
            },
            {
              "x": 95,
              "y": 1742,
              "width": 700,
              "height": 403
            }
          ]
        }
      ],
      "start": "03:55.2",
      "end": "04:12.7"
    },
    {
      "pages": [
        1,
        2
      ],
      "pageAreas": [
        {
          "pageIdx": 1,
          "areas": [
            {
              "x": 816,
              "y": 1788,
              "width": 753,
              "height": 386
            }
          ]
        },
        {
          "pageIdx": 2,
          "areas": [
            {
              "x": 82,
              "y": 138,
              "width": 773,
              "height": 449
            }
          ]
        }
      ],
      "start": "04:12.7",
      "end": "04:22.0"
    },
    {
      "pages": [
        2
      ],
      "pageAreas": [
        {
          "pageIdx": 2,
          "areas": [
            {
              "x": 843,
              "y": 241,
              "width": 717,
              "height": 357
            },
            {
              "x": 79,
              "y": 598,
              "width": 766,
              "height": 347
            }
          ]
        }
      ],
      "start": "04:22.0",
      "end": "04:31.2"
    },
    {
      "pages": [
        2
      ],
      "pageAreas": [
        {
          "pageIdx": 2,
          "areas": [
            {
              "x": 859,
              "y": 598,
              "width": 674,
              "height": 357
            }
          ]
        }
      ],
      "start": "04:31.2",
      "end": "04:36.0"
    },
    {
      "pages": [
        2
      ],
      "pageAreas": [
        {
          "pageIdx": 2,
          "areas": [
            {
              "x": 76,
              "y": 988,
              "width": 1487,
              "height": 386
            },
            {
              "x": 109,
              "y": 1388,
              "width": 175,
              "height": 337
            }
          ]
        }
      ],
      "start": "04:36.0",
      "end": "04:47.0"
    },
    {
      "pages": [
        2
      ],
      "pageAreas": [
        {
          "pageIdx": 2,
          "areas": [
            {
              "x": 115,
              "y": 1375,
              "width": 1431,
              "height": 343
            }
          ]
        }
      ],
      "start": "04:46.5",
      "end": "04:56.2"
    },
    {
      "pages": [
        2,
        3
      ],
      "pageAreas": [
        {
          "pageIdx": 2,
          "areas": [
            {
              "x": 105,
              "y": 1778,
              "width": 1408,
              "height": 383
            }
          ]
        },
        {
          "pageIdx": 3,
          "areas": [
            {
              "x": 72,
              "y": 168,
              "width": 750,
              "height": 429
            }
          ]
        }
      ],
      "start": "04:56.2",
      "end": "05:13.3"
    },
    {
      "pages": [
        3
      ],
      "pageAreas": [
        {
          "pageIdx": 3,
          "areas": [
            {
              "x": 819,
              "y": 185,
              "width": 773,
              "height": 413
            },
            {
              "x": 99,
              "y": 575,
              "width": 700,
              "height": 380
            }
          ]
        }
      ],
      "start": "05:13.3",
      "end": "05:23.4"
    },
    {
      "pages": [
        3
      ],
      "pageAreas": [
        {
          "pageIdx": 3,
          "areas": [
            {
              "x": 794,
              "y": 577,
              "width": 796,
              "height": 409
            },
            {
              "x": 97,
              "y": 981,
              "width": 492,
              "height": 363
            }
          ]
        }
      ],
      "start": "05:23.4",
      "end": "05:33.5"
    },
    {
      "pages": [
        3
      ],
      "pageAreas": [
        {
          "pageIdx": 3,
          "areas": [
            {
              "x": 589,
              "y": 1014,
              "width": 955,
              "height": 363
            },
            {
              "x": 103,
              "y": 1381,
              "width": 340,
              "height": 376
            }
          ]
        }
      ],
      "start": "05:33.5",
      "end": "05:43.6"
    },
    {
      "pages": [
        3
      ],
      "pageAreas": [
        {
          "pageIdx": 3,
          "areas": [
            {
              "x": 87,
              "y": 1758,
              "width": 1454,
              "height": 413
            },
            {
              "x": 467,
              "y": 1368,
              "width": 1097,
              "height": 380
            }
          ]
        }
      ],
      "start": "05:43.6",
      "end": "05:53.6"
    }
  ],
  "videoUrl": "https://www.youtube.com/watch?v=1k_OLrK4ZuE?t=0.9",
  "version": 1,
  "pageUrls": [
    "https://images2.imgbox.com/6c/97/Yzd4DIGU_o.jpg?download=true",
    "https://images2.imgbox.com/64/92/pgnfik4q_o.jpg?download=true",
    "https://images2.imgbox.com/cb/aa/8rCzR3B2_o.jpg?download=true",
    "https://images2.imgbox.com/61/e7/kQuQbxaD_o.jpg?download=true"
  ]
}