{
  "sections": [
    {
      "pages": [
        0
      ],
      "pageAreas": [
        {
          "pageIdx": 0,
          "areas": [
            {
              "x": 200,
              "y": 377,
              "width": 1295,
              "height": 401
            },
            {
              "x": 10,
              "y": 850,
              "width": 190,
              "height": 377
            }
          ]
        }
      ],
      "start": "00:0.9",
      "end": "00:4.7"
    },
    {
      "pages": [
        0
      ],
      "pageAreas": [
        {
          "pageIdx": 0,
          "areas": [
            {
              "x": 0,
              "y": 822,
              "width": 1496,
              "height": 421
            },
            {
              "x": 17,
              "y": 1275,
              "width": 537,
              "height": 459
            }
          ]
        }
      ],
      "start": "00:4.3",
      "end": "00:11.6"
    },
    {
      "pages": [
        0
      ],
      "pageAreas": [
        {
          "pageIdx": 0,
          "areas": [
            {
              "x": 550,
              "y": 1302,
              "width": 945,
              "height": 414
            },
            {
              "x": 10,
              "y": 1798,
              "width": 1003,
              "height": 374
            }
          ]
        }
      ],
      "start": "00:11.7",
      "end": "00:17.8"
    },
    {
      "pages": [
        0,
        1
      ],
      "pageAreas": [
        {
          "pageIdx": 0,
          "areas": [
            {
              "x": 996,
              "y": 1795,
              "width": 605,
              "height": 401
            }
          ]
        },
        {
          "pageIdx": 1,
          "areas": [
            {
              "x": 13,
              "y": 244,
              "width": 343,
              "height": 329
            }
          ]
        }
      ],
      "start": "00:17.7",
      "end": "00:20.7"
    },
    {
      "pages": [
        1
      ],
      "pageAreas": [
        {
          "pageIdx": 1,
          "areas": [
            {
              "x": 353,
              "y": 210,
              "width": 1156,
              "height": 370
            },
            {
              "x": 40,
              "y": 649,
              "width": 992,
              "height": 319
            }
          ]
        }
      ],
      "start": "00:20.7",
      "end": "00:26.7"
    },
    {
      "pages": [
        1
      ],
      "pageAreas": [
        {
          "pageIdx": 1,
          "areas": [
            {
              "x": 1023,
              "y": 639,
              "width": 520,
              "height": 326
            },
            {
              "x": 10,
              "y": 1064,
              "width": 1570,
              "height": 323
            },
            {
              "x": 17,
              "y": 1417,
              "width": 581,
              "height": 363
            }
          ]
        }
      ],
      "start": "00:26.6",
      "end": "00:35.3"
    },
    {
      "pages": [
        1
      ],
      "pageAreas": [
        {
          "pageIdx": 1,
          "areas": [
            {
              "x": 605,
              "y": 1441,
              "width": 928,
              "height": 319
            },
            {
              "x": 20,
              "y": 1832,
              "width": 159,
              "height": 360
            }
          ]
        }
      ],
      "start": "00:35.3",
      "end": "00:39.6"
    },
    {
      "pages": [
        1,
        2
      ],
      "pageAreas": [
        {
          "pageIdx": 1,
          "areas": [
            {
              "x": 20,
              "y": 1819,
              "width": 1513,
              "height": 377
            }
          ]
        },
        {
          "pageIdx": 2,
          "areas": [
            {
              "x": 3,
              "y": 207,
              "width": 1547,
              "height": 377
            },
            {
              "x": 27,
              "y": 605,
              "width": 1499,
              "height": 370
            }
          ]
        }
      ],
      "start": "00:39.1",
      "end": "00:58.6"
    },
    {
      "pages": [
        2
      ],
      "pageAreas": [
        {
          "pageIdx": 2,
          "areas": [
            {
              "x": 30,
              "y": 989,
              "width": 1455,
              "height": 367
            }
          ]
        }
      ],
      "start": "00:58.6",
      "end": "01:10.4"
    },
    {
      "pages": [
        2
      ],
      "pageAreas": [
        {
          "pageIdx": 2,
          "areas": [
            {
              "x": 1526,
              "y": 2186,
              "width": -1516,
              "height": -765
            }
          ]
        }
      ],
      "start": "01:10.4",
      "end": "01:28.4"
    },
    {
      "pages": [
        3
      ],
      "pageAreas": [
        {
          "pageIdx": 3,
          "areas": [
            {
              "x": 6,
              "y": 207,
              "width": 1196,
              "height": 414
            }
          ]
        }
      ],
      "start": "01:28.4",
      "end": "01:32.7"
    },
    {
      "pages": [
        3
      ],
      "pageAreas": [
        {
          "pageIdx": 3,
          "areas": [
            {
              "x": 1098,
              "y": 255,
              "width": 476,
              "height": 387
            },
            {
              "x": 20,
              "y": 652,
              "width": 1526,
              "height": 387
            }
          ]
        }
      ],
      "start": "01:32.4",
      "end": "01:39.8"
    },
    {
      "pages": [
        3
      ],
      "pageAreas": [
        {
          "pageIdx": 3,
          "areas": [
            {
              "x": 20,
              "y": 1047,
              "width": 1519,
              "height": 333
            },
            {
              "x": 10,
              "y": 1428,
              "width": 581,
              "height": 316
            }
          ]
        }
      ],
      "start": "01:39.8",
      "end": "01:45.8"
    },
    {
      "pages": [
        3
      ],
      "pageAreas": [
        {
          "pageIdx": 3,
          "areas": [
            {
              "x": 598,
              "y": 1424,
              "width": 958,
              "height": 336
            }
          ]
        }
      ],
      "start": "01:45.8",
      "end": "01:49.1"
    },
    {
      "pages": [
        3,
        4
      ],
      "pageAreas": [
        {
          "pageIdx": 3,
          "areas": [
            {
              "x": 1455,
              "y": 1451,
              "width": 102,
              "height": 319
            },
            {
              "x": 20,
              "y": 1812,
              "width": 1536,
              "height": 367
            }
          ]
        },
        {
          "pageIdx": 4,
          "areas": [
            {
              "x": 10,
              "y": 224,
              "width": 1526,
              "height": 353
            },
            {
              "x": 27,
              "y": 595,
              "width": 1020,
              "height": 357
            }
          ]
        }
      ],
      "start": "01:48.8",
      "end": "02:0.3"
    },
    {
      "pages": [
        4
      ],
      "pageAreas": [
        {
          "pageIdx": 4,
          "areas": [
            {
              "x": 1050,
              "y": 595,
              "width": 489,
              "height": 363
            },
            {
              "x": 3,
              "y": 982,
              "width": 564,
              "height": 350
            }
          ]
        }
      ],
      "start": "02:0.3",
      "end": "02:3.6"
    },
    {
      "pages": [
        4
      ],
      "pageAreas": [
        {
          "pageIdx": 4,
          "areas": [
            {
              "x": 571,
              "y": 975,
              "width": 962,
              "height": 360
            },
            {
              "x": 13,
              "y": 1356,
              "width": 1030,
              "height": 401
            }
          ]
        }
      ],
      "start": "02:3.6",
      "end": "02:8.7"
    },
    {
      "pages": [
        4
      ],
      "pageAreas": [
        {
          "pageIdx": 4,
          "areas": [
            {
              "x": 802,
              "y": 1523,
              "width": 0,
              "height": 0
            },
            {
              "x": 1037,
              "y": 1377,
              "width": 510,
              "height": 391
            },
            {
              "x": 37,
              "y": 1754,
              "width": 1468,
              "height": 377
            }
          ]
        }
      ],
      "start": "02:8.8",
      "end": "02:19.9"
    }
  ],
  "videoUrl": "https://www.youtube.com/watch?v=1k_OLrK4ZuE",
  "version": 1,
  "pageUrls": [
    "https://images2.imgbox.com/4b/6a/HmnudZ9o_o.jpg?download=true",
    "https://images2.imgbox.com/13/34/zq9gm8Lo_o.jpg?download=true",
    "https://images2.imgbox.com/c3/f6/Tvjo7ahq_o.jpg?download=true",
    "https://images2.imgbox.com/95/2f/oph4GdmY_o.jpg?download=true",
    "https://images2.imgbox.com/56/8e/QbKPtioq_o.jpg?download=true"
  ]
}