{
  "sections": [
    {
      "pages": [
        0
      ],
      "pageAreas": [
        {
          "pageIdx": 0,
          "areas": [
            {
              "x": 121,
              "y": 199,
              "width": 1073,
              "height": 320
            }
          ]
        }
      ],
      "start": "00:01.0",
      "end": "00:14.0"
    },
    {
      "pages": [
        0
      ],
      "pageAreas": [
        {
          "pageIdx": 0,
          "areas": [
            {
              "x": 1219,
              "y": 224,
              "width": 262,
              "height": 286
            },
            {
              "x": 90,
              "y": 526,
              "width": 863,
              "height": 299
            }
          ]
        }
      ],
      "start": "00:14.0",
      "end": "00:26.5"
    },
    {
      "pages": [
        0
      ],
      "pageAreas": [
        {
          "pageIdx": 0,
          "areas": [
            {
              "x": 941,
              "y": 548,
              "width": 558,
              "height": 305
            },
            {
              "x": 63,
              "y": 850,
              "width": 552,
              "height": 320
            }
          ]
        }
      ],
      "start": "00:26.5",
      "end": "00:39.3"
    },
    {
      "pages": [
        0
      ],
      "pageAreas": [
        {
          "pageIdx": 0,
          "areas": [
            {
              "x": 611,
              "y": 893,
              "width": 872,
              "height": 271
            },
            {
              "x": 50,
              "y": 1192,
              "width": 299,
              "height": 289
            }
          ]
        }
      ],
      "start": "00:39.3",
      "end": "00:53.9"
    },
    {
      "pages": [
        0
      ],
      "pageAreas": [
        {
          "pageIdx": 0,
          "areas": [
            {
              "x": 349,
              "y": 1217,
              "width": 872,
              "height": 259
            }
          ]
        }
      ],
      "start": "00:53.9",
      "end": "01:07.8"
    },
    {
      "pages": [
        0
      ],
      "pageAreas": [
        {
          "pageIdx": 0,
          "areas": [
            {
              "x": 1219,
              "y": 1189,
              "width": 289,
              "height": 299
            },
            {
              "x": 109,
              "y": 1501,
              "width": 397,
              "height": 323
            },
            {
              "x": 497,
              "y": 1498,
              "width": 986,
              "height": 348
            }
          ]
        }
      ],
      "start": "01:07.8",
      "end": "01:28.9"
    }
  ],
  "videoUrl": "https://www.youtube.com/watch?v=mukiMaOSLEs",
  "version": 1,
  "pageUrls": [
    "https://images2.imgbox.com/23/43/aHKTQRMr_o.png?download=true"
  ]
}