{
  "sections": [
    {
      "pages": [
        0
      ],
      "pageAreas": [
        {
          "pageIdx": 0,
          "areas": [
            {
              "x": 753,
              "y": 169,
              "width": -724,
              "height": -171
            },
            {
              "x": 14,
              "y": 209,
              "width": 234,
              "height": 176
            }
          ]
        }
      ],
      "start": "04:00.3",
      "end": "04:07.9"
    },
    {
      "pages": [
        0
      ],
      "pageAreas": [
        {
          "pageIdx": 0,
          "areas": [
            {
              "x": 250,
              "y": 208,
              "width": 509,
              "height": 164
            },
            {
              "x": 25,
              "y": 387,
              "width": 285,
              "height": 173
            }
          ]
        }
      ],
      "start": "04:07.9",
      "end": "04:14.4"
    },
    {
      "pages": [
        0
      ],
      "pageAreas": [
        {
          "pageIdx": 0,
          "areas": [
            {
              "x": 312,
              "y": 397,
              "width": 447,
              "height": 179
            },
            {
              "x": 0,
              "y": 565,
              "width": 527,
              "height": 181
            }
          ]
        }
      ],
      "start": "04:14.4",
      "end": "04:22.9"
    },
    {
      "pages": [
        0
      ],
      "pageAreas": [
        {
          "pageIdx": 0,
          "areas": [
            {
              "x": 502,
              "y": 599,
              "width": 256,
              "height": 147
            },
            {
              "x": 6,
              "y": 777,
              "width": 740,
              "height": 173
            }
          ]
        }
      ],
      "start": "04:22.6",
      "end": "04:29.7"
    },
    {
      "pages": [
        0
      ],
      "pageAreas": [
        {
          "pageIdx": 0,
          "areas": [
            {
              "x": 58,
              "y": 4,
              "width": 701,
              "height": 196
            },
            {
              "x": 11,
              "y": 199,
              "width": 237,
              "height": 179
            }
          ]
        }
      ],
      "start": "04:29.7",
      "end": "04:36.8"
    },
    {
      "pages": [
        0
      ],
      "pageAreas": [
        {
          "pageIdx": 0,
          "areas": [
            {
              "x": 253,
              "y": 212,
              "width": 507,
              "height": 168
            },
            {
              "x": 3,
              "y": 384,
              "width": 311,
              "height": 168
            }
          ]
        }
      ],
      "start": "04:36.8",
      "end": "04:42.9"
    },
    {
      "pages": [
        0
      ],
      "pageAreas": [
        {
          "pageIdx": 0,
          "areas": [
            {
              "x": 309,
              "y": 386,
              "width": 447,
              "height": 187
            },
            {
              "x": 11,
              "y": 578,
              "width": 520,
              "height": 184
            }
          ]
        }
      ],
      "start": "04:42.9",
      "end": "04:51.4"
    },
    {
      "pages": [
        0
      ],
      "pageAreas": [
        {
          "pageIdx": 0,
          "areas": [
            {
              "x": 508,
              "y": 594,
              "width": 242,
              "height": 156
            },
            {
              "x": 9,
              "y": 777,
              "width": 733,
              "height": 187
            }
          ]
        }
      ],
      "start": "04:51.2",
      "end": "04:58.3"
    },
    {
      "pages": [
        1
      ],
      "pageAreas": [
        {
          "pageIdx": 1,
          "areas": [
            {
              "x": 37,
              "y": 7,
              "width": 725,
              "height": 179
            },
            {
              "x": 6,
              "y": 205,
              "width": 220,
              "height": 185
            }
          ]
        }
      ],
      "start": "04:58.3",
      "end": "05:05.4"
    },
    {
      "pages": [
        1
      ],
      "pageAreas": [
        {
          "pageIdx": 1,
          "areas": [
            {
              "x": 224,
              "y": 197,
              "width": 538,
              "height": 182
            },
            {
              "x": 11,
              "y": 377,
              "width": 483,
              "height": 206
            }
          ]
        }
      ],
      "start": "05:05.4",
      "end": "05:12.5"
    },
    {
      "pages": [
        1
      ],
      "pageAreas": [
        {
          "pageIdx": 1,
          "areas": [
            {
              "x": 522,
              "y": 401,
              "width": 243,
              "height": 155
            },
            {
              "x": 9,
              "y": 563,
              "width": 759,
              "height": 168
            },
            {
              "x": 499,
              "y": 405,
              "width": 32,
              "height": 142
            }
          ]
        }
      ],
      "start": "05:12.5",
      "end": "05:19.8"
    },
    {
      "pages": [
        1
      ],
      "pageAreas": [
        {
          "pageIdx": 1,
          "areas": [
            {
              "x": 8,
              "y": 780,
              "width": 755,
              "height": 185
            }
          ]
        }
      ],
      "start": "05:19.8",
      "end": "05:26.9"
    },
    {
      "pages": [
        1
      ],
      "pageAreas": [
        {
          "pageIdx": 1,
          "areas": [
            {
              "x": 768,
              "y": 178,
              "width": -761,
              "height": -179
            },
            {
              "x": 5,
              "y": 189,
              "width": 217,
              "height": 188
            }
          ]
        }
      ],
      "start": "05:26.9",
      "end": "05:33.9"
    },
    {
      "pages": [
        1
      ],
      "pageAreas": [
        {
          "pageIdx": 1,
          "areas": [
            {
              "x": 534,
              "y": 401,
              "width": -537,
              "height": 177
            },
            {
              "x": 768,
              "y": 373,
              "width": -562,
              "height": -169
            }
          ]
        }
      ],
      "start": "05:33.9",
      "end": "05:40.8"
    },
    {
      "pages": [
        1
      ],
      "pageAreas": [
        {
          "pageIdx": 1,
          "areas": [
            {
              "x": 544,
              "y": 405,
              "width": 226,
              "height": 146
            },
            {
              "x": 0,
              "y": 567,
              "width": 764,
              "height": 177
            }
          ]
        }
      ],
      "start": "05:40.8",
      "end": "05:48.2"
    },
    {
      "pages": [
        1
      ],
      "pageAreas": [
        {
          "pageIdx": 1,
          "areas": [
            {
              "x": 11,
              "y": 777,
              "width": 751,
              "height": 180
            }
          ]
        }
      ],
      "start": "05:48.2",
      "end": "05:56.0"
    }
  ],
  "videoUrl": "https://www.youtube.com/watch?v=aTopxwu1KUE",
  "version": 1,
  "pageUrls": [
    "https://images2.imgbox.com/f8/2b/l64abGMR_o.jpg?download=true",
    "https://images2.imgbox.com/3b/1c/UsutTWGB_o.jpg?download=true"
  ]
}